<?xml version="1.0"?>
<?xml-stylesheet type="text/xsl" href="/opt/testfarm/lib/config.xsl"?>
<!DOCTYPE CONFIG SYSTEM "/opt/testfarm/lib/config.dtd">

<!-- $Revision$ -->
<!-- $Date$ -->

<CONFIG>
  <DESCRIPTION>
    EWD Demo using a Xvnc Desktop
  </DESCRIPTION>
  <INFO id="System Config Version">
    $Revision$
  </INFO>
  <INFO id="Host Addr">
    127.0.0.1
  </INFO>
  <INFO id="Color Fuzz">
    8
  </INFO>
  <SERVICE id="EWDdisplay">
    <START>
      system('./EWDstart.pl');
      return 0;
    </START>
    <STOP>
      system('killall EWDdisplay.pl');
      return 0;
    </STOP>
  </SERVICE>
  <INTERFACE id="VISU" type="TestFarm::VU" addr="-name VISU-VNC rfb://testfarm\@localhost:1">
    <START>
      sleep 1;
      $I->status();
      $I->capture_refresh(125);
      $I->capture_geometry('600x200+0+0');
      return 0;
    </START>
    <FEATURE id="Display">
      <DESCRIPTION>EWD Display Window</DESCRIPTION>
      <START>
    	use EWDdisplay;
    	EWDdisplay::init($INFO{'Host Addr'});
      </START>
    </FEATURE>
  </INTERFACE>
</CONFIG>
